{
  "custom": {},
  "params": {},
  "props": {},
  "root": {
    "children": [
      {
        "meta": {
          "name": "PascalCaseButton"
        },
        "type": "ia.display.button",
        "position": {
          "x": 0,
          "y": 0
        }
      },
      {
        "meta": {
          "name": "SCREAMING_SNAKE_CASE_LABEL"
        },
        "type": "ia.display.label",
        "position": {
          "x": 0,
          "y": 50
        }
      },
      {
        "meta": {
          "name": "DAT_02_TT_123_A"
        },
        "type": "ia.display.label",
        "position": {
          "x": 0,
          "y": 100
        }
      },
      {
        "meta": {
          "name": "MyComponentWithNumbers123"
        },
        "type": "ia.display.label",
        "position": {
          "x": 0,
          "y": 150
        }
      },
      {
        "meta": {
          "name": "UPPER_WITH_NUMBERS_456"
        },
        "type": "ia.display.label",
        "position": {
          "x": 0,
          "y": 200
        }
      },
      {
        "meta": {
          "name": "camelCaseInvalid"
        },
        "type": "ia.display.label",
        "position": {
          "x": 0,
          "y": 250
        }
      },
      {
        "meta": {
          "name": "snake_case_invalid"
        },
        "type": "ia.display.label",
        "position": {
          "x": 0,
          "y": 300
        }
      },
      {
        "meta": {
          "name": "kebab-case-invalid"
        },
        "type": "ia.display.label",
        "position": {
          "x": 0,
          "y": 350
        }
      },
      {
        "meta": {
          "name": "Mixed_PascalCase_Invalid"
        },
        "type": "ia.display.label",
        "position": {
          "x": 0,
          "y": 400
        }
      },
      {
        "meta": {
          "name": "APIClient"
        },
        "type": "ia.display.label",
        "position": {
          "x": 0,
          "y": 450
        }
      },
      {
        "meta": {
          "name": "HTTPSConnection"
        },
        "type": "ia.display.label",
        "position": {
          "x": 0,
          "y": 500
        }
      },
      {
        "meta": {
          "name": "MyAPIHandler"
        },
        "type": "ia.display.label",
        "position": {
          "x": 0,
          "y": 550
        }
      },
      {
        "meta": {
          "name": "XMLHTTPRequest"
        },
        "type": "ia.display.label",
        "position": {
          "x": 0,
          "y": 600
        }
      },
      {
        "meta": {
          "name": "API_CLIENT_HTTP"
        },
        "type": "ia.display.label",
        "position": {
          "x": 0,
          "y": 650
        }
      },
      {
        "meta": {
          "name": "HTTP_API_URL"
        },
        "type": "ia.display.label",
        "position": {
          "x": 0,
          "y": 700
        }
      },
      {
        "meta": {
          "name": "TT_DAT_API_123"
        },
        "type": "ia.display.label",
        "position": {
          "x": 0,
          "y": 750
        }
      },
      {
        "meta": {
          "name": "IOModuleController"
        },
        "type": "ia.display.label",
        "position": {
          "x": 0,
          "y": 800
        }
      },
      {
        "meta": {
          "name": "CPU_GPU_MONITOR"
        },
        "type": "ia.display.label",
        "position": {
          "x": 0,
          "y": 850
        }
      }
    ],
    "meta": {
      "name": "root"
    },
    "type": "ia.container.coord"
  }
}
