{
  "custom": {},
  "params": {},
  "props": {},
  "root": {
    "children": [
      {
        "meta": {
          "name": "StatusLabel"
        },
        "position": {
          "basis": "30px"
        },
        "props": {
          "text": "PascalCase folder and view"
        },
        "type": "ia.display.label"
      }
    ],
    "meta": {
      "name": "root"
    },
    "props": {
      "direction": "column"
    },
    "type": "ia.container.flex"
  }
}
