{
  "custom": {
    "test": 4,
    "usedByExpression": null,
    "withBinding": null,
    "unusedCustomProp": null,
    "outputToParent": null
  },
  "params": {
    "inputProp": false,
    "outputWithBinding": null,
    "outputWithoutBinding": null,
    "unusedInputParam": null,
    "usedInputParam": "test"
  },
  "propConfig": {
    "custom.expressionPolling": {
      "access": "PRIVATE",
      "binding": {
        "config": {
          "expression": "now()"
        },
        "type": "expr"
      },
      "persistent": false
    },
    "custom.expressionStructurePolling": {
      "binding": {
        "config": {
          "struct": {
            "badPolling": "now()"
          },
          "waitOnAll": true
        },
        "type": "expr-struct"
      },
      "persistent": false
    },
    "custom.test": {
      "onChange": {
        "enabled": null,
        "script": "\treturn previousValue.value * currentValue.value"
      },
      "persistent": true
    },
    "custom.transformPolling": {
      "binding": {
        "config": {
          "path": "view.params.inputProp"
        },
        "transforms": [
          {
            "expression": "now()",
            "type": "expression"
          },
          {
            "expression": "now(5000)",
            "type": "expression"
          },
          {
            "expression": "now(11000)",
            "type": "expression"
          }
        ],
        "type": "property"
      },
      "persistent": false
    },
    "custom.withBinding": {
      "binding": {
        "config": {
          "expression": "{view.params.inputProp} ? 'Active' : 'Inactive'"
        },
        "type": "expr"
      },
      "persistent": true
    },
    "custom.unusedCustomProp": {
      "persistent": true
    },
    "custom.outputToParent": {
      "binding": {
        "config": {
          "expression": "{view.params.usedInputParam}"
        },
        "type": "expr"
      },
      "persistent": true
    },
    "params.inputProp": {
      "paramDirection": "input",
      "persistent": true
    },
    "params.outputWithBinding": {
      "binding": {
        "config": {
          "path": "view.custom.outputToParent"
        },
        "type": "property"
      },
      "paramDirection": "output",
      "persistent": true
    },
    "params.outputWithoutBinding": {
      "paramDirection": "output",
      "persistent": true
    },
    "params.unusedInputParam": {
      "paramDirection": "input",
      "persistent": true
    },
    "params.usedInputParam": {
      "paramDirection": "input",
      "persistent": true
    }
  },
  "props": {},
  "root": {
    "children": [
      {
        "meta": {
          "name": "BadPollingDateTimeInput"
        },
        "position": {
          "basis": "32px"
        },
        "propConfig": {
          "props.value": {
            "binding": {
              "config": {
                "expression": "now()"
              },
              "type": "expr"
            }
          }
        },
        "props": {
          "formattedValue": "Sep 29, 2025 6:24 AM"
        },
        "type": "ia.input.date-time-input"
      },
      {
        "meta": {
          "name": "LabelUsingCustomProp"
        },
        "position": {
          "basis": "32px"
        },
        "propConfig": {
          "props.text": {
            "binding": {
              "config": {
                "expression": "{view.custom.usedByExpression}"
              },
              "type": "expr"
            }
          }
        },
        "props": {
          "text": "Default Text"
        },
        "type": "ia.display.label"
      },
      {
        "events": {
          "component": {
            "onActionPerformed": {
              "config": {
                "script": "\treturn event"
              },
              "scope": "G",
              "type": "script"
            }
          }
        },
        "meta": {
          "name": "Button"
        },
        "position": {
          "basis": "34px"
        },
        "scripts": {
          "customMethods": [
            {
              "name": "custom_binding_refresh",
              "params": [
                "var10",
                "var11"
              ],
              "script": "\t# implement your method here\n\treturn var10 * var11"
            }
          ],
          "extensionFunctions": null,
          "messageHandlers": []
        },
        "type": "ia.input.button"
      }
    ],
    "meta": {
      "name": "root"
    },
    "props": {
      "direction": "column"
    },
    "type": "ia.container.flex"
  }
}