{
  "custom": {},
  "params": {},
  "props": {},
  "root": {
    "children": [
      {
        "meta": {
          "name": "PascalCaseButton"
        },
        "type": "ia.input.button"
      },
      {
        "meta": {
          "name": "SCREAMING_SNAKE_CASE_LABEL"
        },
        "position": {
          "y": 50
        },
        "type": "ia.display.label"
      },
      {
        "meta": {
          "name": "DAT_02_TT_123_A"
        },
        "position": {
          "y": 100
        },
        "type": "ia.display.label"
      },
      {
        "meta": {
          "name": "MyComponentWithNumbers123"
        },
        "position": {
          "y": 150
        },
        "type": "ia.display.label"
      },
      {
        "meta": {
          "name": "UPPER_WITH_NUMBERS_456"
        },
        "position": {
          "y": 200
        },
        "type": "ia.display.label"
      },
      {
        "meta": {
          "name": "camelCaseInvalid"
        },
        "position": {
          "y": 250
        },
        "type": "ia.display.label"
      },
      {
        "meta": {
          "name": "snake_case_invalid"
        },
        "position": {
          "y": 300
        },
        "type": "ia.display.label"
      },
      {
        "meta": {
          "name": "kebab-case-invalid"
        },
        "position": {
          "y": 350
        },
        "type": "ia.display.label"
      },
      {
        "meta": {
          "name": "Mixed_PascalCase_Invalid"
        },
        "position": {
          "y": 400
        },
        "type": "ia.display.label"
      },
      {
        "meta": {
          "name": "APIClient"
        },
        "position": {
          "y": 450
        },
        "type": "ia.display.label"
      },
      {
        "meta": {
          "name": "HTTPSConnection"
        },
        "position": {
          "y": 500
        },
        "type": "ia.display.label"
      },
      {
        "meta": {
          "name": "MyAPIHandler"
        },
        "position": {
          "y": 550
        },
        "type": "ia.display.label"
      },
      {
        "meta": {
          "name": "XMLHTTPRequest"
        },
        "position": {
          "y": 600
        },
        "type": "ia.display.label"
      },
      {
        "meta": {
          "name": "API_CLIENT_HTTP"
        },
        "position": {
          "y": 650
        },
        "type": "ia.display.label"
      },
      {
        "meta": {
          "name": "HTTP_API_URL"
        },
        "position": {
          "y": 700
        },
        "type": "ia.display.label"
      },
      {
        "meta": {
          "name": "TT_DAT_API_123"
        },
        "position": {
          "y": 750
        },
        "type": "ia.display.label"
      },
      {
        "meta": {
          "name": "IOModuleController"
        },
        "position": {
          "y": 800
        },
        "type": "ia.display.label"
      },
      {
        "meta": {
          "name": "CPU_GPU_MONITOR"
        },
        "position": {
          "y": 850
        },
        "type": "ia.display.label"
      }
    ],
    "meta": {
      "name": "root"
    },
    "type": "ia.container.coord"
  }
}